{
  "schema_version": "1.0.0",
  "generated_at": "2026-10-08T07:20:00Z",
  "tool": {
    "id": "claude-code",
    "surface": "Claude Code",
    "adapter_version": "1.0.0"
  },
  "framework": {
    "name": "AI-DLC",
    "version": "2.10.0",
    "scope": "aicc-engineering-standard"
  },
  "intent": {
    "id": "261008-multi-ide-standard",
    "title": "AICC Multi-IDE Engineering Standard",
    "guard_policy": "strict"
  },
  "stages": [
    {
      "slug": "intent-capture",
      "phase": "ideation",
      "status": "completed",
      "produced_artifacts": [
        "artifacts/sample-governance.md"
      ]
    },
    {
      "slug": "code-generation",
      "phase": "construction",
      "status": "completed",
      "produced_artifacts": [
        "artifacts/sample-governance.md"
      ]
    }
  ],
  "tests": {
    "framework": "python-unittest",
    "total": 3,
    "passed": 3,
    "failed": 0,
    "results_path": "artifacts/test-results.json"
  },
  "artifacts": [
    {
      "path": "artifacts/sample-governance.md",
      "sha256": "526df3f180e66c73d41561854acd0395d6db043c5ff49d2706dce5956420f5eb",
      "kind": "governance"
    },
    {
      "path": "artifacts/test-results.json",
      "sha256": "897392f8b37900a4d29b55fea64a8878460159e44ef4c98ab307b3877bc785f2",
      "kind": "test-results"
    }
  ],
  "approvals": {
    "verifiable_by_ci": false,
    "declared_gates": [
      {
        "stage": "intent-capture",
        "declared_outcome": "approved"
      }
    ]
  }
}
